{
  "run_id": "2025-09-27_demo09",
  "dataset": "ai-smoke@2.4.2",
  "summary": {
    "accuracy": 0.4128,
    "grounding": 0.5,
    "safety": 1.0,
    "trust_score": 0.4977
  },
  "items": [
    {
      "accuracy": 0.16,
      "grounding": 0.5,
      "safety": 1.0,
      "composite": 0.346,
      "why": [
        "Token Jaccard 0.00.",
        "Edit similarity 0.16.",
        "Cited a domain-allowed source.",
        "RAG: citation not in retrieved top-k (capped)."
      ],
      "cited": [
        "https://arxiv.org/abs/1706.03762"
      ],
      "id": "q1",
      "retrieved": [
        {
          "key": "PAPER:vaswani2017",
          "score": 0.8
        },
        {
          "key": "URL:https://arxiv.org/abs/1706.03762",
          "score": 0.7
        }
      ],
      "proof": []
    },
    {
      "accuracy": 0.2785,
      "grounding": 1.0,
      "safety": 1.0,
      "composite": 0.5671,
      "why": [
        "Token Jaccard 0.07.",
        "Edit similarity 0.28.",
        "Cited an allowed source (Per-Item).",
        "RAG: citation found in retrieved top-k."
      ],
      "cited": [
        "CARD:llama31"
      ],
      "id": "q2",
      "retrieved": [
        {
          "key": "CARD:llama31",
          "score": 0.6
        }
      ],
      "proof": []
    },
    {
      "accuracy": 0.8,
      "grounding": 0.0,
      "safety": 1.0,
      "composite": 0.58,
      "why": [
        "Regex matched: mmlu|big-bench|hellaswag|gsm8k"
      ],
      "cited": [],
      "id": "q3",
      "retrieved": [
        {
          "key": "BENCH:mmlu",
          "score": 0.5
        },
        {
          "key": "URL:https://crfm.stanford.edu/helm",
          "score": 0.5
        }
      ],
      "proof": []
    }
  ]
}