{
  "run_id": "2025-09-28_core02",
  "dataset": "core",
  "summary": {
    "accuracy": 0.46,
    "grounding": 0.34,
    "safety": 1.0,
    "trust_score": 0.478
  },
  "items": [],
  "model": "model-3",
  "meta": {
    "dataset": "core@2.2.0",
    "prompt_cfg": "icl-8shot-v2",
    "retriever": "hybrid-v3",
    "date": "2025-09-28",
    "prov": "error"
  }
}