{
  "run_id": "2025-09-27_demoC",
  "dataset": "ai-smoke@2.0.0",
  "summary": {
    "accuracy": 0.5139,
    "grounding": 0.0,
    "safety": 1.0,
    "trust_score": 0.4083
  },
  "items": [
    {
      "accuracy": 0.2917,
      "grounding": 0.0,
      "safety": 1.0,
      "composite": 0.275,
      "cited": [],
      "why": [
        "Token Jaccard 0.07.",
        "Levenshtein~ 0.29.",
        "No allowed source cited.",
        "RAG: cited not in retrieved; grounding capped."
      ],
      "proof": null,
      "id": "q1"
    },
    {
      "accuracy": 0.45,
      "grounding": 0.0,
      "safety": 1.0,
      "composite": 0.37,
      "cited": [],
      "why": [
        "Token Jaccard 0.30.",
        "Levenshtein~ 0.45.",
        "No allowed source cited.",
        "RAG: cited not in retrieved; grounding capped."
      ],
      "proof": null,
      "id": "q2"
    },
    {
      "accuracy": 0.8,
      "grounding": 0.0,
      "safety": 1.0,
      "composite": 0.58,
      "cited": [],
      "why": [
        "Regex matched: mmlu|big-bench|hellaswag|gsm8k",
        "No allowed source cited."
      ],
      "proof": null,
      "id": "q3"
    }
  ]
}